{"atoms":[{"attributes":{"classification":"internal"},"id":"a0","kind":"resource","role":"TARGET","value":"report"}],"audit":{"source":"interop"},"carrier":{"profile":"json"},"confidence":0.5,"context":{"conversation_id":"c1","references":[],"thread_id":"t1","timezone":"Europe/Amsterdam","turn":2,"window":{"turns":4}},"evidence":[{"id":"e0","source_ref":"urn:user:request","source_type":"user"}],"id":"p2","output":{"format":"JSON","language":"en","max_bytes":4096,"requirements":["concise"]},"permissions":{"forbid":["urn:report:archive"],"limits":{"max_items":10},"mode":"PREVIEW","require_logging":true,"scope":["urn:report:1"]},"pragmatics":{"goal":"summarize","speech_act":"command","type":"request","urgency":0.25},"relations":[{"arguments":["a0"],"attributes":{"source":"example"},"confidence":0.75,"id":"r0","type":"requests"}],"version":"0.1"}